[
  {
    "id": "T3-BucketLarge-J-1.1",
    "bucket": "BucketLarge-J",
    "case_id": "0001",
    "pearl_level": "L1",
    "domain": "D10",
    "subdomain": "Digital Media",
    "difficulty": "Easy",
    "is_ambiguous": false,
    "scenario": "An organization reports a very positive statistic for Average star rating based only on observations from a subset of people.\nThe subset is formed by Who leaves reviews that is voluntary or outcome-dependent.\nInternal notes suggest people with negative experiences are less likely to be observed in the dataset.",
    "claim": "An organization reports a very positive statistic for Average star rating based only on observations from a subset of people",
    "variables": {
      "X": {
        "name": "Who leaves reviews",
        "role": "Treatment/Factor"
      },
      "Y": {
        "name": "Average star rating",
        "role": "Outcome"
      },
      "Z": [
        "Underlying true outcome (positive/negative)"
      ]
    },
    "trap": {
      "type": "W1",
      "type_name": "Selection Bias",
      "subtype": "Sampling-on-the-Outcome",
      "subtype_name": "Sampling Bias"
    },
    "label": "YES",
    "causal_structure": "Z affects whether an observation is recorded (X), and Y is computed only among observed cases.",
    "key_insight": "Observed outcomes reflect who is observed, not the full population.",
    "gold_rationale": "I don’t have enough information to make a definitive causal claim from the summary statistics alone. We need to know how units enter the treated/observed group and what pre-existing differences drive selection (especially Underlying true outcome (positive/negative)); otherwise Who leaves reviews–Average star rating differences may reflect selection rather than effect.",
    "wise_refusal": "I don’t have enough information to make a definitive causal claim from the summary statistics alone. We need to know how units enter the treated/observed group and what pre-existing differences drive selection (especially Underlying true outcome (positive/negative)); otherwise Who leaves reviews–Average star rating differences may reflect selection rather than effect.",
    "hidden_timestamp": "At what point were units selected into the observed sample—before or after Average star rating occurred—and is selection related to Underlying true outcome (positive/negative) or Average star rating?",
    "conditional_answers": {
      "A": "Answer if Who leaves reviews is randomly assigned: A difference in Average star rating across Who leaves reviews groups can be interpreted causally.",
      "B": "Answer if participation/exposure is voluntary or selected (e.g., Underlying true outcome (positive/negative)): The Who leaves reviews vs not-Who leaves reviews difference in Average star rating is biased by who ends up observed/treated.",
      "C": "Answer if you can measure the selection drivers (e.g., Underlying true outcome (positive/negative)) and adjust (matching/weighting/IV): The conclusion becomes CONDITIONAL on those assumptions and model quality."
    },
    "initial_author": "Sreya Vangara",
    "validator": "Fernando Torres",
    "final_score": 8.87
  },
  {
    "id": "T3-BucketLarge-J-1.2",
    "bucket": "BucketLarge-J",
    "case_id": "0002",
    "pearl_level": "L1",
    "domain": "D10",
    "subdomain": "Psychology",
    "difficulty": "Easy",
    "is_ambiguous": false,
    "scenario": "An organization reports a very positive statistic for Reported improvement based only on observations from a subset of people.\nThe subset is formed by Who shares outcomes that is voluntary or outcome-dependent.\nInternal notes suggest people with negative experiences are less likely to be observed in the dataset.",
    "claim": "An organization reports a very positive statistic for Reported improvement based only on observations from a subset of people",
    "variables": {
      "X": {
        "name": "Who shares outcomes",
        "role": "Treatment/Factor"
      },
      "Y": {
        "name": "Reported improvement",
        "role": "Outcome"
      },
      "Z": [
        "Underlying true outcome (positive/negative)"
      ]
    },
    "trap": {
      "type": "W1",
      "type_name": "Selection Bias",
      "subtype": "Sampling-on-the-Outcome",
      "subtype_name": "Sampling Bias"
    },
    "label": "YES",
    "causal_structure": "Z affects whether an observation is recorded (X), and Y is computed only among observed cases.",
    "key_insight": "Observed outcomes reflect who is observed, not the full population.",
    "gold_rationale": "I don’t have enough information to make a definitive causal claim from the summary statistics alone. We need to know how units enter the treated/observed group and what pre-existing differences drive selection (especially Underlying true outcome (positive/negative)); otherwise Who shares outcomes–Reported improvement differences may reflect selection rather than effect.",
    "wise_refusal": "I don’t have enough information to make a definitive causal claim from the summary statistics alone. We need to know how units enter the treated/observed group and what pre-existing differences drive selection (especially Underlying true outcome (positive/negative)); otherwise Who shares outcomes–Reported improvement differences may reflect selection rather than effect.",
    "hidden_timestamp": "At what point were units selected into the observed sample—before or after Reported improvement occurred—and is selection related to Underlying true outcome (positive/negative) or Reported improvement?",
    "conditional_answers": {
      "A": "Answer if Who shares outcomes is randomly assigned: A difference in Reported improvement across Who shares outcomes groups can be interpreted causally.",
      "B": "Answer if participation/exposure is voluntary or selected (e.g., Underlying true outcome (positive/negative)): The Who shares outcomes vs not-Who shares outcomes difference in Reported improvement is biased by who ends up observed/treated.",
      "C": "Answer if you can measure the selection drivers (e.g., Underlying true outcome (positive/negative)) and adjust (matching/weighting/IV): The conclusion becomes CONDITIONAL on those assumptions and model quality."
    },
    "initial_author": "Sreya Vangara",
    "validator": "Fernando Torres",
    "final_score": 9.26
  },
  {
    "id": "T3-BucketLarge-J-1.3",
    "bucket": "BucketLarge-J",
    "case_id": "0003",
    "pearl_level": "L1",
    "domain": "D10",
    "subdomain": "Education Sociology",
    "difficulty": "Medium",
    "is_ambiguous": false,
    "scenario": "A report finds that regions/organizations with higher County average broadband access also have higher Student grades on average.\nA commentator concludes that any individual inside a region with higher County average broadband access will have higher Student grades.\nHowever, individual-level data within regions shows large variation, and the within-region relationship is weak or opposite once relevant individual factors are considered.",
    "claim": "any individual inside a region with higher County average broadband access will have higher Student grades",
    "variables": {
      "X": {
        "name": "County average broadband access (group-level)",
        "role": "Treatment/Factor"
      },
      "Y": {
        "name": "Student grades (individual-level)",
        "role": "Outcome"
      },
      "Z": [
        "Individual-level characteristics"
      ]
    },
    "trap": {
      "type": "W7",
      "type_name": "Confounding",
      "subtype": "Socioeconomic",
      "subtype_name": "Socioeconomic"
    },
    "label": "YES",
    "causal_structure": "Group-level aggregates summarize heterogeneous individuals; group-level correlation does not imply the same relation at the individual level.",
    "key_insight": "You cannot infer individual behavior reliably from group-level correlations.",
    "gold_rationale": "I don’t have enough information to make a definitive causal claim from the summary statistics alone. The evidence is at an aggregate level, but the conclusion is about individuals. I would need individual-level data (or a defensible model of sorting into groups) before inferring how County average broadband access (group-level) relates to Student grades (individual-level) for a person.",
    "wise_refusal": "I don’t have enough information to make a definitive causal claim from the summary statistics alone. The evidence is at an aggregate level, but the conclusion is about individuals. I would need individual-level data (or a defensible model of sorting into groups) before inferring how County average broadband access (group-level) relates to Student grades (individual-level) for a person.",
    "hidden_timestamp": "Is County average broadband access (group-level) measured at an aggregate level while Student grades (individual-level) is an individual claim, and when/where does aggregation into Individual-level characteristics happen relative to measuring Student grades (individual-level)?",
    "conditional_answers": {
      "A": "Answer if you only have aggregate correlations: You cannot infer individual-level behavior; the relationship may be confounded by group-level factors.",
      "B": "Answer if you have individual-level data within groups: Estimate the within-group association/effect and check whether it matches the aggregate pattern.",
      "C": "Answer if there is sorting/selection into groups: Treat conclusions as CONDITIONAL unless you model the sorting mechanism or use a design that breaks it."
    },
    "initial_author": "Sreya Vangara",
    "validator": "Fernando Torres",
    "final_score": 8.0
  },
  {
    "id": "T3-BucketLarge-J-1.4",
    "bucket": "BucketLarge-J",
    "case_id": "0004",
    "pearl_level": "L1",
    "domain": "D10",
    "subdomain": "Criminology",
    "difficulty": "Medium",
    "is_ambiguous": false,